source,appid,game_name,is_dlc,player_type,review_id,steam_language,created_at,updated_at,voted_up,votes_up,votes_funny,comment_count,weighted_vote_score,steam_purchase_type,received_for_free,written_during_early_access,steam_deck,review_text,author_steamid,author_num_games_owned,author_num_reviews,author_playtime_forever,author_playtime_last_two_weeks,author_playtime_at_review,author_last_played
steam,580100,Crimson Court,True,unknown,198652693,english,2025-07-01T15:16:20+00:00,2025-07-01T15:18:37+00:00,True,0,0,0,0.5,,False,False,,"If you haven't finished the base game, don't buy this.
 
[i]The Crimson Court's[/i] brutal difficulty will probably leave any inexperienced player behind, but for those who crave the extra challenge, it will serve as a fine addition.",76561198814325950,0,16,0,0,,1970-01-01T00:00:00+00:00
steam,580100,Crimson Court,True,unknown,193402525,english,2025-04-23T11:25:58+00:00,2025-04-23T11:25:58+00:00,False,0,1,0,0.476190477609634399,,False,False,,the crimson curse is very poorly designed and is a pain in the ass to cure,76561198896119825,142,26,0,0,,1970-01-01T00:00:00+00:00
steam,580100,Crimson Court,True,unknown,205520438,english,2025-09-30T04:53:04+00:00,2025-09-30T04:53:04+00:00,False,4,2,0,0.544072985649108887,,False,False,,This is $10 spent to make the game objectively worse.,76561198079353149,0,2,0,0,,1970-01-01T00:00:00+00:00
steam,580100,Crimson Court,True,unknown,207822072,english,2025-10-28T21:00:35+00:00,2025-10-28T21:00:35+00:00,True,3,0,1,0.47999998927116394,,False,False,,Best DLC don't listen to these mad kid reviews. Git good.,76561197961337299,94,21,0,0,,1970-01-01T00:00:00+00:00
steam,580100,Crimson Court,True,unknown,213531020,english,2025-12-17T22:51:51+00:00,2025-12-17T22:51:51+00:00,False,4,1,0,0.527259707450866699,,False,False,,"Worst addition to the game. Period.
",76561198076262328,0,4,0,0,,1970-01-01T00:00:00+00:00
steam,580100,Crimson Court,True,unknown,186950537,english,2025-02-02T00:20:25+00:00,2025-02-02T00:20:25+00:00,True,1,1,0,0.523809552192687988,,False,False,,"You are hereby cordially invited to witness the indelible and the goriest at The Crimson Court.


Bring a plus four",76561198022941652,148,206,0,0,,1970-01-01T00:00:00+00:00
steam,580100,Crimson Court,True,unknown,194771710,english,2025-05-12T19:10:03+00:00,2025-05-12T19:10:03+00:00,True,16,2,0,0.581572413444519043,,False,False,,negative reviews are all skill issues lol.,76561198087090683,0,6,0,0,,1970-01-01T00:00:00+00:00
steam,580100,Crimson Court,True,unknown,187279178,english,2025-02-06T07:47:57+00:00,2025-02-06T07:47:57+00:00,True,4,0,0,0.567147612571716309,,False,False,,Made me mad. Does what is says.,76561199339643781,0,6,0,0,,1970-01-01T00:00:00+00:00
steam,580100,Crimson Court,True,unknown,194216434,english,2025-05-04T15:03:09+00:00,2025-05-04T15:03:09+00:00,False,3,5,0,0.528935074806213379,,False,False,,even I'M not masochistic enough for this :(,76561198045913600,198,79,0,0,,1970-01-01T00:00:00+00:00
steam,580100,Crimson Court,True,unknown,205842315,english,2025-10-04T09:47:46+00:00,2025-10-04T09:47:46+00:00,False,2,0,0,0.476190477609634399,,False,False,,biggest piece of dogshit,76561198163535027,320,57,0,0,,1970-01-01T00:00:00+00:00
steam,580100,Crimson Court,True,unknown,199780116,english,2025-07-14T12:29:09+00:00,2025-07-14T12:29:09+00:00,True,1,0,0,0.505813956260681152,,False,False,,"Cool DLC, I love vampire so this is a must",76561198133201611,157,44,0,0,,1970-01-01T00:00:00+00:00
steam,580100,Crimson Court,True,unknown,212076368,english,2025-11-30T18:46:21+00:00,2025-11-30T18:46:21+00:00,False,5,7,0,0.584300339221954346,,False,False,,fuck that stupid crocodile,76561198255799666,114,34,0,0,,1970-01-01T00:00:00+00:00
steam,580100,Crimson Court,True,unknown,205871360,english,2025-10-04T16:30:20+00:00,2025-10-04T16:30:20+00:00,True,6,3,1,0.555183947086334229,,False,False,,"git gud
10/10 dlc",76561198160628883,193,14,0,0,,1970-01-01T00:00:00+00:00
steam,580100,Crimson Court,True,unknown,207248571,english,2025-10-21T16:37:11+00:00,2025-10-21T16:37:11+00:00,False,3,0,0,0.489442169666290283,,False,False,,not good,76561199137581622,46,19,0,0,,1970-01-01T00:00:00+00:00
steam,580100,Crimson Court,True,unknown,195507181,english,2025-05-23T23:39:37+00:00,2025-05-23T23:39:37+00:00,True,1,0,0,0.476190477609634399,,False,False,,The casual filter™,76561198350422501,0,39,0,0,,1970-01-01T00:00:00+00:00
steam,580100,Crimson Court,True,unknown,207775861,english,2025-10-28T09:18:16+00:00,2025-10-28T09:18:16+00:00,True,6,2,0,0.601449251174926758,,False,False,,Total masochism.,76561198107344360,210,223,0,0,,1970-01-01T00:00:00+00:00
steam,580100,Crimson Court,True,unknown,187297393,english,2025-02-06T13:46:18+00:00,2025-02-06T13:46:18+00:00,True,4,0,0,0.518781721591949463,,False,False,,it make it harder,76561198083226208,0,1,0,0,,1970-01-01T00:00:00+00:00
steam,580100,Crimson Court,True,unknown,202141025,english,2025-08-14T22:01:53+00:00,2025-08-14T22:01:53+00:00,True,1,0,0,0.5,,False,False,,Very fun addition to the main game,76561199202617083,0,10,0,0,,1970-01-01T00:00:00+00:00
steam,580100,Crimson Court,True,unknown,198396825,english,2025-06-28T21:00:56+00:00,2025-06-28T21:00:56+00:00,True,2,0,0,0.477463245391845703,,False,False,,mad because bad,76561198116917246,133,39,0,0,,1970-01-01T00:00:00+00:00
steam,580100,Crimson Court,True,unknown,202422621,english,2025-08-18T23:51:46+00:00,2025-08-18T23:51:46+00:00,False,0,0,0,0.471698105335235596,,False,False,,Don't.,76561198295817413,320,61,0,0,,1970-01-01T00:00:00+00:00
steam,580100,Crimson Court,True,unknown,189958219,english,2025-03-11T16:48:54+00:00,2025-03-11T16:48:54+00:00,False,0,0,0,0.431372553110122681,,False,False,,KYS DLC,76561198016902974,212,117,0,0,,1970-01-01T00:00:00+00:00
steam,580100,Crimson Court,True,unknown,212726895,english,2025-12-06T21:51:03+00:00,2025-12-06T21:51:03+00:00,True,1,0,0,0.5,,False,False,,Peak dlc,76561199051319976,0,2,0,0,,1970-01-01T00:00:00+00:00
steam,580100,Crimson Court,True,unknown,208979873,english,2025-11-11T19:30:40+00:00,2025-11-12T09:15:55+00:00,False,1,0,0,0.5,,False,False,,:(,76561198313777507,0,11,0,0,,1970-01-01T00:00:00+00:00
steam,580100,Crimson Court,True,unknown,62176080,english,2020-01-21T10:25:40+00:00,2020-01-21T10:25:40+00:00,True,214,4,6,0.938541889190673828,,False,False,,"This DLC is a weird one, granted all the complaints and salt about it were (and to some degree still are) completely justified. However, most of the issued have been ironed out, but I shall go into detail in regard to them later. First I have to say that at the current state the DLC is well worth it, with a huge ""BUT"" to consider first though. 

Now, a little bit of spoilers about it (not that it really matters in 2020), it's important to note that this DLC, once started, will inflict an affliction onto your roster, which if you are not prepared, can stress you out by outright threatening your roster to die out due to the Crimson Curse. However, the issue is not as prevailing as it used to be, infected heroes will need blood every couple weeks / dungeon runs, if they go for too long without it (3 checks / graving) they WILL die as a result. 
Fortunately the blood is no longer hard to come by as it used to be (which is the reason for the majority of negative reviews btw), so there are a couple of counter-measures that should be established before heading into the first Crimson Court mission.

[b](Again little bit of spoilers, but this is information one NEEDS to know if one is to actually enjoy this DLC)[/b]

-Hold off from actually starting the first CC mission until you are well established ( small cash reserve and the Sanguine Vitner building which will produce 2 blood every week, allowing you to maintain almost a dozen heroes without the stress of them dying.
-Once the Curse afflicted your roster, supply runs can be launched to stock up on blood
-Drinking holy water reduces the change of heroes getting afflicted by the CC
-Putting cursed heroes into buildings with non-cursed ones WILL spread the curse in the hamlet
-Defeating a boss in the Crimson Court cures all heroes
-Bringing cursed heroes into regular mission will trigger a chance of them being hunted by a wandering boss (you will be warned in the loading screen if he is present tho), so make sure you are prepared facing that threat
-Defeating the final boss of the Crimson Court allows you to cure the Crimson Curse in your Sanatorium whenever you want.

[b]Now to some negatives that still affect the game / DLC:[/b]

-Once you go into the Courtyard, the CC enemies will infest ALL other areas of the game, meaning you will be put on time pressure to clear a courtyard boss after a couple of normal missions, because more and more of your roster will become afflicted.
-The Crimson Court opens up to early for how difficult it is, stressing out newer, unprepared players by forcing all the mechanics onto them if they thought they could tackle the thing.
-The dungeons are a tad bit too big, I had to refer to the revealed maps online so I don't walk circles and dead ends for HOURS due to back tracking / locked gates


[b]Now to the goods, and why it's definitely worth to get:[/b]

-Districts, for very useful and cool bonuses 
-Very cool enemy design and theme
-Flagellant new class which is fun and unique to use
-Entirely different from the base game in terms of how the dungeons are structured and tackled
-Very useful trinkets which provide additional set bonuses 
-Once you got the hang of the game, it still offers a fun challenge after 100+ hours

All in all, I didnt regret jumping into the DLC in the long run, while I initially considered deleting my save file and starting over for how overwhelmed and stressed out I was when the DLC forced all its mechanics on me after I foolishly went into the first Courtyard mission with little preparedness. Now I have finished the whole thing and I am glad I stuck to it and duked it out. 
If you want the Crimson Curse to be more of an unfortunate accident instead of a certainty then I'd recommend getting the 
""Reduced Crimson Curse Chance"" mod: https://steamcommunity.com/sharedfiles/filedetails/?id=953225902
",76561197982081165,502,47,0,0,,1970-01-01T00:00:00+00:00
steam,580100,Crimson Court,True,unknown,86589033,english,2021-02-14T01:37:49+00:00,2021-02-14T01:37:49+00:00,True,226,0,0,0.932490885257720947,,False,False,,"If you haven't played this game before, DO NOT ENABLE CRIMSON COURT CONTENT. The warning about it being for experienced players isn't a joke. The Crimson Court adds an interesting, challenging, and frankly desperately needed mid-game objective for veteran players that requires resource and roster management to conquer effectively. If you want to get the dlc for your first playthrough, DISABLE CRIMSON COURT, keep on districts and flagellant until you beat the base game AT LEAST ONCE. There are enough negative reviews on a perfectly good expansion that people don't need to give it more bad ratings because it doesn't hold their hands.

Flagellant: 
Great class, fantastic to have another healer on the roster, really unique playing front liner with heals, bleed, and high risk/reward content with abilities that only activate at low HP threshholds. A lot of fun to play with. Only real downside is that he only uses Flagellation Hall for stress relief so you'll want to upgrade that early if you plan on using him.

Districts: 
Fantastic addition, great mid to late game resource dump for when you start accumulating lots of money once you've upgraded all your buildings and don't have to spend as much on your heroes. They give passive bonuses for your town or party members. Not a whole lot to say, just good to have another upgrade path.

Crimson Court:
For better or for worse, game changing. The concept is simple: There's a huge, sprawling new area called the Crimson Court, a new enemy class called Bloodsuckers, and a new game mechanic called the Crimson Curse. The Curse is contracted through certain attacks Bloodsuckers have and can't be cured like other diseases, and cursed heroes require a new item, The Blood, almost constantly, or they risk dying on expeditions or cursing your other heroes when idle in town. This isn't for casuals. It really makes you play differently, wondering whether it'll be worth it to keep a good hero on your roster if it'll risk compromising the rest of the adventurers and prioritising bringing your most valuable heroes to boss fights to kill Crimson Court bosses, which cures the Curse. As you progress through the Court, Bloodsuckers start showing up in other areas in increasingly large numbers, resulting in every expedition becoming riskier the longer you leave the Court unattended, with the final reward being the ability to cure the Curse at the Sanitarium, like any other disease. 

All in all, Crimson Court gives Darkest Dungeon's midgame the kick in the ass it desperately needed. If you're a fan of darkest dungeon, don't listen to casual players badmouthing the expansion just because it wasn't what they wanted. Give it a chance, and you might be surprised how intense it gets.",76561198044806737,1043,147,0,0,,1970-01-01T00:00:00+00:00
steam,580100,Crimson Court,True,unknown,115703450,english,2022-05-19T20:02:13+00:00,2022-05-19T20:02:13+00:00,True,189,0,0,0.901780068874359131,,False,False,,"Don't listen to the salty reviews, but be warned if you decide to enable this DLC for your first playthrough. It is hard. It will affect your progression through the campaign. Whether you're a new player wanting to give it a try or someone looking to try it out on a second playthrough, here are seven bits of advice from someone who's been playing with CC enabled from the beginning:

1. The Flagellant is worth the price of admission alone. He's a frontline healer with powerful damage over time in the form of bleed and the ability to transfer other party members' stress to himself (and he has an inexpensive camp skill that reduces his stress by a ton). He's good in any area except the Ruins. Don't sleep on Reclaim and Redeem, as they are powerful healing skills. Reclaim is not affected by healing skill buffs or debuffs.

2. Don't feel pressured to do the first Courtyard quest as soon as the town event ""The Town is Abuzz"" takes place. It will slightly lower the stress heal your heroes get from activities, but you can sit on that for as long as you want until you feel ready to start the Courtyard's questline. Personally I would recommend going in with a party of level 2 characters. After you complete this first quest, you gain an ""infestation level"". The higher it is, the more often Courtyard enemies will start showing up in other areas.

3. If you need Blood for your Cursed characters, there is always a short quest available in the Courtyard called ""Gather the Blood"" that will net you about 12 with each expedition. You can also build the Sanguine Vintners district, which will add two bottles of Blood to your stock each week for free.

4. The Fanatic is a powerful roaming boss who shows up with a town event when you reach Medium infestation. If you take two or more Cursed characters to a regular dungeon, there's a chance he will follow you in and stalk you. If you aren't specifically geared to fight the Fanatic, just leave. The game will warn you if he's in the dungeon with you with a special loading screen. He won't show up if you have only one party member with the Crimson Curse. He can't show up on boss quests or in the Courtyard, so send all your cursed party members there for XP.

5. You may notice you need ""invitations"" to enter the Crimson Court's Epic quests. These items are dropped by Gatekeepers, which have a chance to spawn as part of any Courtyard mash that appears in a normal biome. They tend to run on Turn 2 and are very fast, so prioritize killing them if you want the drop. The cocoon curio that appears at higher infestation levels will always spawn a Gatekeeper, so that's a semi-reliable way of farming invitations if you need them.

6. Bring lots of food, Blood, Torches, and Shovels to Crimson Court Epic quests. Don't bother bringing any keys, since the special chests that are supposed to give you Crimson Court trinkets will just give you normal loot instead if you use a key on them. Courtyard is always considered to be at 100% torch, but torches are used to clear obstacles, interact with curios, and provide a temporary accuracy buff to your whole party. Shovels are used to smash certain curios that will give you firewood to camp. Don't be afraid of leaving early. The game doesn't expect you to finish it in a single week. If you have a lot of good loot, feel free to abandon the quest. When you return, you'll be in the same place you left off.

7. There's no shame in installing mods to tune the experience to your liking, just like the rest of Darkest Dungeon. Don't let elitists tell you that doing so is ""wrong"" or somehow an incorrect way to play the game.

I hope this review-slash-guide was helpful and encourages you to give Crimson Court a try despite the naysayers. I have, and it's provided me with tens of hours of fun!",76561198121254760,0,9,0,0,,1970-01-01T00:00:00+00:00
steam,580100,Crimson Court,True,unknown,42883436,english,2018-06-20T19:46:00+00:00,2018-06-21T06:20:00+00:00,True,312,2,4,0.951365888118743896,,False,False,,"Hey hey hey, they fixed it!
With the colours of madness patch, I've noticed SIGNIFIGANTLY less random crimson curse shit in other locations, as well as less of my guys catching the crimson curse. (I went through 3 dungeons in the courtyard, still nobody has been infected) 
Ignore the previous reviews about it taking away from the base game! It now is what it should be: an add on.

Update: I checked the patch notes, stuff in random locations hasn't ben reduced, but the chance to catch Crimson curse from attacks has been reduced from 30%-40% down a flat 18.9%!",76561198275545381,317,25,0,0,,1970-01-01T00:00:00+00:00
steam,580100,Crimson Court,True,unknown,34520715,english,2017-08-27T04:36:29+00:00,2017-08-27T14:34:06+00:00,False,244,9,5,0.889590978622436523,,False,False,,"Oh god, what happened here?

The Crimson Court DLC adds five news things to the base game: a handful of ancestral trinkets that operate like a ""set"" bonus in a hack-n-slash, a new character called The Flagellant, a new debuff called The Crimson Curse that is essentially vampirism, a new roaming boss called The Fanatic, and the eponoymous Crimson Court area, 

Let's break down these things and discuss how every single one of these new things is ultimately flawed and makes the game WORSE.


First, the ancestral trinkets are all fairly weak, or they require strange positioning to work properly, such as your Vestal being in position 2, where she can't use her best healing, but this also buffs her Divine Comfort. So...why put your healer in harm's way to buff a worse ability, when she could be in the back and use both? The Abomination set requires him to be in the first position for a damage buff. You know, where he can't use most of his not-transformed abilities. Some are pretty solid, but the base trinkets are almost universally better, and the odds on getting both trinkets for one class is extremely low.


Second, The Flagellant. Basic logic would say that this is a character that maybe gets stronger as his health gets low. Well, kind of. He gains a damage buff when below 33% health. Problem is, his damage isn't good. However, ALL of his damage abilities cause excessive amounts of Bleed damage, making him very powerful in most areas. He also creates a healing nova on death (?!) and heals even more when at Death's Door (?!) and has both a personal heal and can heal others if his health is low. So, this means that The Flagellant has a bunch of skills that seem like they were designed by five different people in five different rooms, a buff that doesn't effect him, debuffs that further lower his damage (But not his Bleed!), and this leads to him being essentially a necessary pick. I'm not opposed to having extremely good characters in this game, but just nothing about him makes sense other than ""Position 1, hit enemy until they take 20 Bleed damage per round, heal self to full if about to die"".


Third, The Crimson Curse. The logic behind this is that your characters will need a new item called The Blood. If they don't get this item, they die. You have almost no options to deal with this except being forced to go to the Crimson Court, which is about as fun as a stick in the eye for reasons I'll explain later. The Crimson Curse is caused by new roaming monsters that can appear anywhere. Normally, these fights are just a lttle bit tougher than other enemies at the same level, and that's kind of cool. However, the most common new enemy is called The Sycophant, a giant mosquito. They have extremely high speed, so they always go first, extremely high dodge, so they survive much longer than is necessary, can cause stress and high amounts of bleed, as well as have the highest chance to cause Crimson Curse. Once again, there is nothing you can do about this. You get into a fight, better flip a coin that it's not Crimson Curse monsters (and by that, I mean their spawn rate is so ridicously high, I can say, without exaggeration, about half of your fights in the game will be these things), then flip another that you won't recieve a nearly permanent debuff. Even worse, this waters down the creature pool, because they can spawn anywhere, drastically limiting unique and fun party compositions because you constantly have to plan around the Crimson Court monsters. Sound like fun? Because it's not. The Crimson Curse is also spread by characters sharing buildings with each other during stress relief, so you'll start putting one character at a time in a building, slowing the game's pace to a crawl for fear of making the problem worse. Oh, but that's not all Crimson Curse does that is about as fun as licking a piece of steel wool...

Fourth, The Fanatic. If you take more than one character with The Crimson Curse into a dungeon, you have a large chance that The Fanatic will follow you in. Like The Collector or Shambler, The Fanatic appears randomly instead of a normal group of enemies. Once again, cool idea, like you're being hunted by a vampire hunter. The issue is that The Fanatic is completely unbalanced on a very basic level. He always begins with surprise for arbitrary difficulty increase. Begins the battle with ""Sentence Rendered"", removing one of your characters from the battle and attaching them to a burning stake, not unlike the Hag battle with her cauldron. You have an arbalist in the back? Too bad. He get your healer? You just lost. Why do you lose? Well, he gets three actions per round! Why? Arbitrary difficulty! Stress damage, bleed damage, stress over time, party removal, The Fanatic is easily the hardest fight in the game, drops the mostly terrible Crimson Court trinkets and a SINGLE USE Crimson Curse Cure. There is literally no reason to fight him. He's not impossible, just frustrating, boring, random, and pointless. It's more expedient to just leave the dungeon if the game says he's followed you in, and when I DON'T WANT TO EXPERIENCE CONTENT I PAYED FOR, there's a problem.

Then, we come to The Crimson Court itself. The main problem with the Crimson Court is that there are three (technically four) levels to it. Unlike the other areas of the game, these areas have the same map every single time, and you're expected to go as far as you can, then retreat and return with a different party where you left off. This is really cool the first time, but every subsequent time, you find yourself just rolling your eyes and looking up the map online. Otherwise, there is a lot of time backtracking through empty rooms, looking for that one room you missed that has the key in it, so you can walk all the way back, to open a door, and do it again, ending with a pretty neat boss for every level. It isn't as bad as the other problems, but it's tedious, boring, and the only pluses to doing so are...Crimson Court trinkets, and every level cures everyone in your party of Crimson Curse. 

So, let's recap. A permanent debuff caused by roaming mobs that you can't stop because they attack first, which causes a roaming boss to attack that is ridiculously unbalanced to the rest of the game, and the only way to stop it is to go into an area that causes the curse MORE OFTEN, that is boring to play, to get trinkets that aren't very good, and the main reason to do it at all is to GET RID OF THE PERMANENT DEBUFF IN THE FIRST PLACE. This means that the DLC is a giant cycle to FIX PROBLEMS THAT IT INTRODUCED. 

Sorry, but that sucks. This DLC isn't fun, it weighs the entire game down with unncessary frustration and flow-breaking mechanics, fails to create a proper ticking clock to encourage exploration, and literally the BEST part is that you can turn off the Crimson Court, but keep The Flagellant. Don't get me wrong, it's not like the DLC is broken or too difficult, it just isn't fun on a fundamental level. 

Without a major overhaul, this DLC is dead on arrival, period.",76561197987962663,647,61,0,0,,1970-01-01T00:00:00+00:00
