source,appid,game_name,is_dlc,player_type,review_id,steam_language,created_at,updated_at,voted_up,votes_up,votes_funny,comment_count,weighted_vote_score,steam_purchase_type,received_for_free,written_during_early_access,steam_deck,review_text,author_steamid,author_num_games_owned,author_num_reviews,author_playtime_forever,author_playtime_last_two_weeks,author_playtime_at_review,author_last_played
steam,580100,Crimson Court,True,unknown,206826043,english,2025-10-16T02:25:45+00:00,2025-10-16T02:25:45+00:00,False,79,40,0,0.837761282920837402,,False,False,,"Does The Crimson Court make the game harder? Yes. Are the mechanics of the Crimson Curse annoying to micromanage? Yes. Overall, is the DLC well designed? No. BUT, does it make the game more fun to play? Also no.",76561198219954049,120,5,0,0,,1970-01-01T00:00:00+00:00
steam,580100,Crimson Court,True,unknown,187494941,english,2025-02-08T19:57:33+00:00,2025-02-16T17:22:11+00:00,True,27,2,0,0.771408200263977051,,False,False,,"Once you start this DLC you NEED to finish it. You can dance around the other DLC(Color of Madness) if you're stubborn and Butcher's Circus is completely optional. This is not. This is a 'I beat the game and want to do something new!' not a 'this will integrate well with my experience once I start getting level whatever heroes consistently and master some mechanics'. I will show up at your home on my hands and knees begging you to not enable this DLC until you are endgame or near it. Monsters from this DLC can appear in other dungeons and while it's not guaranteed the Crimson Curse is pretty easily transmissible, and it's effect are very hard to deal with when your roster starts getting more and more infected with limited supplies to deal with it. Frankly it's really easy for Crimson Court to overwhelm your game, even softlock you.

I started it on a file where I had already beaten the game and I actually found it really engaging. A infectious disease DOES spread like wildfire, it DOES make sense close quarters might spread it, disease spreading rampantly and dominating my town DOES make sense to me, you DO need to mitigate or treat a disease and it's more negatives than positives(unless you're metagaming and optimizing). I though it was very cool. I thought the enemies were very cool. If I was unfortunate enough to play it early-mid game I can see it completely ruining things for me. The repetition is also an issue and I personally really hate an invitation mechanic. It forces you to grind even longer for a chance at progressing the plot. I would get this on sale exclusively AFTER you've beaten the game or are at the endgame.

Generic tips and tricks for the interested:

-Please don't do it man, take the left mouse button off your finger on the DLC enable screen man, it's not worth it yet. Beat the game or get to endgame first

-Be prepared for the Crimson Curse to dominate your roster eventually. I kept a dedicated team to rotate in and out with strict placement to avoid the spread, flat out fleeing combat with anything that might infect others

-The Flagellant is a very interesting and cool new character to have on your team. I think his presence alone made the DLC much more engaging

-There are certain trinkets that are borderline mandatory to defeat the last boss, and there is not a guarantee you will get all of them before having the opportunity to fight. Be aware there is an optimal way to do it",76561198400890911,27,61,0,0,,1970-01-01T00:00:00+00:00
steam,580100,Crimson Court,True,unknown,190390004,english,2025-03-16T18:28:49+00:00,2025-03-16T18:28:49+00:00,False,24,1,0,0.739126384258270264,,False,False,,"I feel conflicted about this DLC.

On one hand, it introduces a new region with cool map mechanics, a new hero, and a ton of interesting monsters. On the other hand, this expansion does the cardinal sin of mixing DLC content with base game content. The end result is that Crimson Court's monsters, of which there are many annoying ones, eventually flood all other regions.

My advice? Beat the base game first, and only then activate the Crimson Court.",76561197990586203,0,12,0,0,,1970-01-01T00:00:00+00:00
steam,580100,Crimson Court,True,unknown,197465625,english,2025-06-17T15:26:00+00:00,2025-06-17T15:26:00+00:00,True,26,1,0,0.731242835521697998,,False,False,,"While I can understand the mixed reception I think this is ultimately a pretty great DLC. If i had to guess, the disconnect between those who like it and those who do not might largely comes from 2 elements: 1. The Fanatic and Investation feel cheap to the new player with how hard it can be to avoid infection and not take infected party members with you on quests at times and 2. Crimson Court's content warping the game around it rather than enhancing the base game.

My thoughts are as follows:
1. Yes, the Fanatic absolutely is cheap and frankly, I don't like his inclusion in his current state. He is my major problem with  this DLC because unlike other RNG mechanics like The Things From The Stars or Bloodsucker encounters, he feels nearly impossible to be prepared for at all times. Crimson Curse can spread so fast due to infestation that it is not an uncommon occurrence that an average skill player will *have* to take infected party members with them for a decent composition. However, having a decent composition that is *also* good at staying healthy AND fighting off the Fanatic is a big ask for something that is completely up to chance. Compare this to The Thing From The Stars, who is also a random encounter but is shown to roam one specific area on the map at a time. This means that if your current available party members are not good at fighting him, you can simply avoid that area for the time being. The Fanatic is ALWAYS there, can show up at any point during most quests so long as one VERY common condition is met, and he is extremely dangerous. It's not very fun, especially for players new to the DLC.

2. I feel the rest is a general disconnect between a decent part of the playerbase and what I believe Red Hook was trying to accomplish with the DLC. I think *because* it is paid DLC many people might come into Crimson Court with the expectation that since they had a pay a decent amount for it, this is content *any* darkest dungeon will be able to enjoy rather than a rework of the main campaign designed for hardcore fans to make an already hard game EVEN harder. The game warns you that this is not the case, and that you should play this only after beating a regular campaign, and I do wonder how many of the players who walked away disliking the DLC took this warning seriously seeing as quite a few Crimson Court DLC achievements have a higher completion rate than beating the base game on Radiant, or how many base game players really tried to change and adapt their playstyle to fit the new challenges and needs the DLC presents. Infestation can seem annoying or unfair at first, but focusing on collecting a significant amount of trinkets that buff your units against bloodsuckers specifically will help out a lot when dealing with these additional random encounters, while also increasing your ability to deal with threats in the Courtyard. The Crimson Curse is also a new thing you'll have to manage and outside of the Fanatic I think it is an interesting mechanic that adds another level of inventory and item management, and as long as you recognize the necessity to rush the Sanguine Vinters, which produces two vials of blood each week, this too never gets too overwhelming from my experience.

On top of this, the Crimson Court adds incredibly engaging lore, a really cool aesthetic, an interesting new area (although I hate the crocodilian boss and the Epic length layouts are probably a bit **too** long) If you treat the DLC for what it is, that being a harder, new way to experience the Darkest Dungeon campaign, I think it succeeds at that exceptionally well.

Also the Flagellant rules what a sick character whose role as a bleed stacker with consistent, strong healing opens up so many more teamcomps. If you enjoyed your playthrough of the base game and are looking for a different take on it, definitely get Crimson Court. Otherwise, you are probably better off waiting for a sale and buying the DLC for cheap for the Flagellant (who can be enabled seperately from the Crimson Court campaign).",76561198158015575,0,11,0,0,,1970-01-01T00:00:00+00:00
steam,580100,Crimson Court,True,unknown,192631616,english,2025-04-13T03:57:04+00:00,2025-04-13T03:57:04+00:00,False,33,4,0,0.717974185943603516,,False,False,,"This dlc will bug you until you interact with it, literally, it will replace ALL random town events with mosquitoes that reduce stress removal.  kinda like a little kid that repeats ""Hey watch this"" over and over until you respond.

In this metaphor the little kid then flips their eyelids inside out and proceeds to run around screaming and wreaking the place because you finally got annoyed enough to tell them to stop. 

As soon as you interact with this dlc that demands your attention, it invades the rest of the game, mobs will spawn that spread a curse to your heroes that if you where not prepared to deal with vampire aids, you are cooked.

I get that it warns you that you shouldn't enable it on a frist run. However that doesn't do it justice. It might be better locked behind a new games+ for when you've first BEATEN the game. 

The most galling part is it lists the first dungeon as a level one and then when you go to treat it as a level one it pops up a box that says ""Oh actually you should send level 3s in here"". If only there was an easy way you could convey the difficultly of a level with easy to read numbered values and color say green to red for easy to hard.",76561198047826945,0,10,0,0,,1970-01-01T00:00:00+00:00
steam,580100,Crimson Court,True,unknown,203296092,english,2025-09-01T02:50:06+00:00,2025-09-01T02:50:06+00:00,False,22,0,0,0.699630081653594971,,False,False,,"I think the mixed reviews are deserved.  

Good:
The bosses are very difficult and the new dungeons are massive and persistent (you can leave and come back).  Neat to go through.  Note that the first visit is just a normal dungeon, not persistent.

Bad:
There's a lot of padding/grinding.  Each visit to the crimson court requires an invitation.  To get an invitation, you need to wait for your town infestation to grow to high.  Takes several weeks.  Then you need to go into a dungeon and hope to find a gatekeeper.  Kill the gatekeeper before he runs away, and you got an invitation.  You can't store invitations, because each boss requires a new type of invitation. 

Repeat this process every time you want to make progress in the new massive persistent dungeon.  You'll spend more time grinding invitations than clearing the Crimson Court.  This is not good design.",76561198004369747,0,20,0,0,,1970-01-01T00:00:00+00:00
steam,580100,Crimson Court,True,unknown,202823617,english,2025-08-25T00:18:40+00:00,2025-08-25T00:18:40+00:00,True,15,0,0,0.676960110664367676,,False,False,,"I think a lot of people fail to realise that this dlc is meant to spice of the game for experienced players. Yes its intrusive and can be very annoying at times, but the enemies, items, new dungeon and mechanics add complexity that is much needed on a second play-through of the game. The fanatic mechanic is kind of terrible as there is basically no way to prepare for him on your first run in, and most players are basically guaranteed to have a team wiped by him. By far the worst part of the dlc. Otherwise this dlc does what it sets out to do very well, and is a lot of fun.",76561198100449025,0,19,0,0,,1970-01-01T00:00:00+00:00
steam,580100,Crimson Court,True,unknown,212916971,english,2025-12-09T14:29:59+00:00,2025-12-09T14:29:59+00:00,True,10,0,0,0.653815984725952148,,False,False,,"Very good DLC, but do not use it on your first playthrough (or wait a few in-game weeks before activating it) as it makes the game more difficult and forces you to do quests in the new location.
Also: don't underestimate the crocodilian.",76561199681442449,31,5,0,0,,1970-01-01T00:00:00+00:00
steam,580100,Crimson Court,True,unknown,203182422,english,2025-08-30T13:49:32+00:00,2025-08-30T13:49:32+00:00,True,9,7,0,0.649594008922576904,,False,False,,"Don't buy it. This is annoying and just makes the game worse.

Unless you're a masochist like me",76561199169516147,0,4,0,0,,1970-01-01T00:00:00+00:00
steam,580100,Crimson Court,True,unknown,189051532,english,2025-03-01T11:20:56+00:00,2025-03-01T11:20:56+00:00,True,9,0,0,0.623379051685333252,,False,False,,"Really cool DLC thats definitely worth it IF you have finished the base game and want more content, warning it is not easy and probably not worth it for a first playthrough.",76561199095412633,180,3,0,0,,1970-01-01T00:00:00+00:00
steam,580100,Crimson Court,True,unknown,212182102,english,2025-11-30T22:14:19+00:00,2025-11-30T22:14:19+00:00,True,8,0,0,0.613317728042602539,,False,False,,"This DIC is hard, like REALLY HARD, but its also realy good, like REALLY GOOD
I really advise anyone playing for the first time to not enable this DLC because it will be too punishing
However, once you feel confident, go right ahead, slap that baby on and enjoy the new massive dungeons!",76561199033276515,456,68,0,0,,1970-01-01T00:00:00+00:00
steam,580100,Crimson Court,True,unknown,194524449,english,2025-05-09T08:45:53+00:00,2025-05-09T08:45:53+00:00,True,8,0,0,0.612885773181915283,,False,False,,"Yeah it changes the gameplay loop.
yeah if you ignore it everything else gets more diffucult.
Yeah it adds another thing you need to worry about while adventuring.

Adds a boatload of strong equipment to compensate for diffuculty.
Worthwhile to add late in playthrough.",76561198995421486,83,22,0,0,,1970-01-01T00:00:00+00:00
steam,580100,Crimson Court,True,unknown,215737571,english,2026-01-11T12:11:50+00:00,2026-01-11T12:11:50+00:00,False,5,3,0,0.587601244449615479,,False,False,,"After finishing the game a long time ago without this DLC enabled, I decided to play this game again, but this time with Crimson Court, without any prior knowledge of this DLC. At first, I enjoyed the DLC because I had played the game before, and the new mechanics brought a fresh breeze and a new challenge to the game, but around the late midgame I started to hate it so much. First of all, the Crimson Curse is not entirely bad, when your characters go into Bloodlust, it’s actually a buff, and a pretty good one nonetheless. HOWEVER, it’s incredibly annoying to micromanage, and even more so when a lot of your people have it, because that means doing Crimson Court dungeons and wasting your time to get enough blood vials so your people don’t die, which can happen.
Now, the second thing that pissed me off are the enemies, with many of them being able to randomly infect your heroes with the Crimson Curse. Now, that wouldn’t be too bad if they were restricted to the new Crimson Court area, BUT THEY AREN’T. EVERY TIME I GO INTO A DUNGEON, I HAVE TO FIGHT THOSE CUNTS ON MULTIPLE OCCASIONS, RISKING MORE PEOPLE GETTING INFECTED EVERY TIME. And not just that, they are purposefully made as annoying as possible to fight against, having high dodge and high speed.
But let’s say you don’t mind that too much and would still like to experience this DLC. Then enjoy doing the new, amazing, EPIC length dungeons, which are about as enjoyable as inserting broken glass up your anus. To some extent, I understand the decision to add something new, but they really messed up with the new EPIC dungeons. Overall, I wouldn’t recommend this DLC unless you really like hurting yourself. Almost everything it adds just leads to a worse experience of the game, so… just don’t.",76561198407125261,106,14,0,0,,1970-01-01T00:00:00+00:00
steam,580100,Crimson Court,True,unknown,204831697,english,2025-09-21T02:01:27+00:00,2025-09-21T02:01:27+00:00,False,6,0,0,0.580152690410614014,,False,False,,"I am alright with most of the DLC. I like the new class districts are a nice addition, and a new area is always good. It is an area for more experienced players. But the curse being given with random new enemy encounter in every area is annoying, and the Fanatic boss is so stupid it makes me want to turn the game off for it being a random encounter most likely ending in a TPK if you do not escape or have the correct party. If you are going to create a surprise boss, it should be able to be killed with any good or decent party with enough skill not specific ones. if you like having to fail missons or get random TPK's  if not playing certain parties this is the DLC for you!",76561199068451500,0,2,0,0,,1970-01-01T00:00:00+00:00
steam,580100,Crimson Court,True,unknown,209875500,english,2025-11-22T20:34:22+00:00,2025-11-22T20:34:22+00:00,True,11,0,1,0.576210498809814453,,False,False,,"People leaving negative reviews don't understand that this is meant to add extra pressure to the runs of veteran players. Do not use this on a first playthrough. It's meant to shake up the gameplay loop and force you to manage infestation once you already understand the base game in and out.

It's very fun and well-made, it forces you to engage with its mechanics without *feeling* forced. The long, multi-week dungeon crawls are really fun, making a lot of progress bit by bit is really satisfying. Bosses are well-designed and unique.",76561198352982108,0,79,0,0,,1970-01-01T00:00:00+00:00
steam,580100,Crimson Court,True,unknown,207295117,english,2025-10-22T07:51:14+00:00,2025-10-22T07:51:14+00:00,True,6,0,1,0.5741233229637146,,False,False,,"Brutal DLC for an already brutal game, Crimson Court is not meant to be approached on your first playthrough of DD, but if you brave it's blood drenched corridors, you will find challenge and treasure aplenty.",76561198055471193,479,29,0,0,,1970-01-01T00:00:00+00:00
steam,580100,Crimson Court,True,unknown,192431638,english,2025-04-10T14:15:04+00:00,2025-04-10T14:15:04+00:00,True,6,1,0,0.571000635623931885,,False,False,,"Do you love Darkest Dungeon but wish it was even harder and more demanding? This is the DLC for you!

Crimson Court has the most content of any Darkest Dungeon DLC by far, as in addition to the very challenging Crimson Court quest line, you get the Flagellant, Districts, and lore trinkets, all of which make the game better.

DO pick this one up.
DO NOT enable it on your first playthrough.",76561198038520959,0,147,0,0,,1970-01-01T00:00:00+00:00
steam,580100,Crimson Court,True,unknown,214458885,english,2025-12-28T16:47:55+00:00,2025-12-28T16:47:55+00:00,False,7,6,0,0.568843841552734375,,False,False,,"Finally decided to start playing darkest dungeon and try to beat the game however, i did not realize that this DLC could be turned off, i got to week 110 and i just couldn't do it anymore, this DLC forces you to waste so much time micromanaging the stupid crimson curse disease and the bosses like the crocodilian or countess are absolute nonsense and reliant on RNG, i cannot in good faith recommend this DLC to anyone 

you WILL be nagged incessantly to collect blood, and you WILL be forced to play the dlc if enabled too as they invade regular dungeons and shit up the whole experience where you'll just want to fire any heroes that get infected",76561198038252155,567,17,0,0,,1970-01-01T00:00:00+00:00
steam,580100,Crimson Court,True,unknown,216403303,english,2026-01-20T14:28:41+00:00,2026-01-20T14:28:41+00:00,False,3,0,0,0.567204296588897705,,False,False,,"As mush as I want to like this DLC, every time I try it I regret it. It makes the game harder but in a boring and tedious way, the expeditions into the crimson court are long and tedious and the bosses aren't fun either",76561198130423243,230,19,0,0,,1970-01-01T00:00:00+00:00
steam,580100,Crimson Court,True,unknown,204582904,english,2025-09-17T22:32:45+00:00,2025-09-17T22:32:45+00:00,True,4,0,1,0.566929101943969727,,False,False,,"IMO absolutely necessary DLC to this game, adds so much more content that is very challenging.

With 1 Con that i would not recommend playing with this DLC enabled for any new player, they will be overwhelmed.",76561198018089366,0,35,0,0,,1970-01-01T00:00:00+00:00
steam,580100,Crimson Court,True,unknown,201744021,english,2025-08-09T02:17:42+00:00,2025-08-09T02:17:42+00:00,True,8,2,0,0.561057984828948975,,False,False,,"Easily the best DLC for any game I have ever played. This DLC is for people who played the base game and beat it and want a brand new experience with even more challenge. And to all the people hating on this dlc who didn't read the disclaimer that the devs put at the start of the game before they let you enable CC, Git Gud.",76561198125895574,0,18,0,0,,1970-01-01T00:00:00+00:00
steam,580100,Crimson Court,True,unknown,200021134,english,2025-07-17T16:25:33+00:00,2025-07-17T16:25:33+00:00,False,8,1,0,0.55248105525970459,,False,False,,"Literally ruins the game. The main plot is forcefully replaced with dealing the annoyance that is this DLC, giving you nothing but headache in the form of debuffing your party with a disease randomly. You cannot avoid getting infected, you are literally forced to deal with the stuff and grind as it dictates. Because of that disease your heroes will need to consume a resource that you will need to farm for them. This whole no-fun no-brain grind, the endless ""epic"" dungeons related and the whole insectoid vampiric vibe ruined my gameplay with the added boredom and frustration, I would not recommend it at all.",76561198870742416,346,77,0,0,,1970-01-01T00:00:00+00:00
steam,580100,Crimson Court,True,unknown,198583782,english,2025-06-30T20:10:42+00:00,2025-06-30T20:10:42+00:00,True,4,0,0,0.550264537334442139,,False,False,,"its a really good set of additional mechanics that changes how you play the game, adding what feels like an entire game's worth of content. but it can be so demanding and time consuming that it WILL take over your playthrough if you don't keep a constant eye on it and/or look up guides on the missions

thats not a bad thing, and it does feel appropriately forgiving... but those missions are LONG. it's like a whole new journey as you send in team after team and take breaks to resupply your... vital resources. so when the blood starts pumping, thats going to be the SOLE FOCUS of your next couple hours

THAT is the reason why people (and the game itself) recommend that you don't turn this on for a first playthrough, it literally forces you to stop playing the base game and play JUST the crimson court for hours at a time. or you will lose ALL your guys over and over and over, and the only way to stop it is to go on that bloodsucker binge. its disruptive to the game's progression and flow, and it WILL massively inflate the runtime.

if you want that, buy it! but i definitely regret enabling it on my first playthrough. i cant juggle this incredibly long game AND constant bloody sidequests. its like a challenge mode.",76561198125361958,644,127,0,0,,1970-01-01T00:00:00+00:00
steam,580100,Crimson Court,True,unknown,188365459,english,2025-02-20T21:21:07+00:00,2025-02-20T21:21:07+00:00,True,3,0,0,0.547802269458770752,,False,False,,"I would recommend getting this DLC after playing the vanilla game and see if you like it.

If you like a grindy  gameplay in the vanilla game, you should probably like this DLC.

There is quite a bit of content to do, and huge quests that are different than in the original game in that you can come back to them and continue, which is quite nice.",76561198118170073,0,5,0,0,,1970-01-01T00:00:00+00:00
steam,580100,Crimson Court,True,unknown,203914355,english,2025-09-09T01:04:17+00:00,2025-09-09T01:04:17+00:00,False,4,1,0,0.5466461181640625,,False,False,,"A joyless slog that should be suffered through once, at most, and then never again. Do not activate this unless you plan on doing an entire play-through around it. Which I do not recommend.",76561199155607296,0,12,0,0,,1970-01-01T00:00:00+00:00
steam,580100,Crimson Court,True,unknown,213027088,english,2025-12-11T04:32:29+00:00,2025-12-11T04:32:29+00:00,True,2,0,0,0.545454561710357666,,False,False,,"Stylish, weird, complex and enriches the base game.
Brilliant remixing of mechanics, charming new enemy faction full of clever designs and attacks, every new boss is a blast to fight.
Besides the Crimson Curse itself, it includes other elements that permeate the base DD experience; The Flagellant is my favorite character by a longshot, and Districts dramatically improve the game's economy. These elements can be individually enabled without having the proper Crimson Court location/curse/enemies included if you just want these for the vanilla gameplay experience.
The Crimson Court is Darkest Dungeon at its most creative and daring.",76561198001017595,321,12,0,0,,1970-01-01T00:00:00+00:00
steam,580100,Crimson Court,True,unknown,198384790,english,2025-06-28T18:19:16+00:00,2025-06-28T18:19:16+00:00,False,9,0,0,0.5899810791015625,,False,False,,Just don't play this DLC on your first playthrough — it's annoying and has misleading descriptions in-game. You need much better units than it suggests.,76561198165826163,205,4,0,0,,1970-01-01T00:00:00+00:00
steam,580100,Crimson Court,True,unknown,197565500,english,2025-06-18T20:06:06+00:00,2025-06-18T20:06:06+00:00,False,4,1,0,0.535021066665649414,,False,False,,Cool story and enemies that are hidden behind a pile of annoying shit that just makes the game worse,76561198129699691,297,10,0,0,,1970-01-01T00:00:00+00:00
steam,580100,Crimson Court,True,unknown,196617291,english,2025-06-07T12:08:42+00:00,2025-06-07T12:08:42+00:00,True,3,0,0,0.529085874557495117,,False,False,,"very good DLC, introduces an interesting location and of course increases the level of difficulty",76561198040717621,0,12,0,0,,1970-01-01T00:00:00+00:00
