source,appid,game_name,is_dlc,player_type,review_id,steam_language,created_at,updated_at,voted_up,votes_up,votes_funny,comment_count,weighted_vote_score,steam_purchase_type,received_for_free,written_during_early_access,steam_deck,review_text,author_steamid,author_num_games_owned,author_num_reviews,author_playtime_forever,author_playtime_last_two_weeks,author_playtime_at_review,author_last_played
steam,580100,Crimson Court,True,unknown,54928201,english,2019-09-02T02:40:40+00:00,2019-09-02T02:40:40+00:00,False,34,0,0,0.736082017421722412,,False,False,,"I wish I could recommend the Crimson Court DLC, because I love all its parts.

I love the new enemies. The Crimson Curse is a unique and dreadful take on a very, very old myth - the vampire. The court itself has beautiful and terrifying backgrounds, curios, and designs. Incorporating the court into a normal game creates an interesting challenge. The new champion type is very fitting for the setting, and has interesting skills and abilities. The new boss fights and enemies are well-designed, challenging, and range from bothersome to frightening.

So why don't I like this expansion?

The whole, in this instance, is much less than the sum of its parts, and it mostly comes down to level design. In order to defeat the challenges of the Crimson Court, one must venture into the court and defeat its boss monsters. Sound familiar? It should. That's the same formula for the rest of the game, one that works. But they made a huge mistake.

Firstly, the bosses are in defined maps that never change, and they are very, very large, sprawling maps. They make the DD3 mission look rather small in comparison. Unfortunately, there's also no firewood given to you for any of these maps - while it's possible to loot some, that's never enough to get through the whole map in one go-through. The progress of each party is saved though, so it seems at least that part was anticipated. Unfortunately, that's not enough.

Each of these maps will take multiple attempts to clear. So the first few ventures, perhaps event the first eight or ten ventures in the larger maps, they will all fail. That means no resolve XP is awarded for them. They're very high-level maps (almost universally intended for max level heroes) so you're risking your high-level heroes for no reward. In addition, if you run out of high level heroes (very possible due to the very lethal nature of the court and its bosses), you'll have to level up more of them outside of the court. The new updates to the coach help, but you can never throw fresh heroes into these missions and hope to accomplish anything. So the new missions suck up all your resources and drain you dry, giving precious little in return.

What's even worse, they are very large and have locked doors with color-coded keys. So you spend a lot of your time simply walking from one end of the map to the other. Have I mentioned they're huge maps? They're huge, with tons and tons of dead space. Be prepared to spend a large amount of time just walking into dead space with nothing actually happening.

I was very disappointed, because everything else about the DLC was great. If they had just made the Court a regular dungeon like the Cove or the Weald, I'd have happily recommended it to you.",76561198019431008,0,24,0,0,,1970-01-01T00:00:00+00:00
steam,580100,Crimson Court,True,unknown,36132650,english,2017-10-30T05:49:40+00:00,2017-10-30T06:14:11+00:00,True,32,0,0,0.735484719276428223,,False,False,,"After having played DD's original campaign, I was eager to start a new campain with Crimson Curse installed. After all, any dark dungeon worthy of that name has to have bloodsucking creatures.

The design of the “vampires” is interesting: not your standard vampires and certainly not vampires that sparkle in the sun but more like parasites. You will face mosquitos and ticks and hybrids between these and humans which are dressed like 17th century nobles. Everytime these creatures bite your heroes, there is a chance that they become infected with the crimson curse and that means that they will start craving blood.

And so, you will have to gather the blood by either completing a gathering mission, finding the blood as loot or building a new district in your hamlet. 

The new districts are something to look forward to as they do add extra benefits e.g. the bank adds a 5% interest on stored gold every week. However, they are expensive and will require a lot of money and deeds/crests in order to be built. Also, you will need blueprints which will only drop from either the CC bosses or the vanilla bosses at higher levels so, no blueprints from low level bosses. One blueprint will be given for free as a town event. This will result in most of the new buildings to be built only later on once you have a more gold and higher level heroes.

Personally, I believe that these new building are not essential; I only built the vinters building for the extra blood production and the bank.

The new mechanic brought by having afflicted heroes can be tedious: you will have to manage your blood which, luckily enough, is rather easy to get but, should you have too many heroes with the curse, it will become a game of balancing normal quests and gathering blood quests. 

Which brings me to the new wandering boss: the fanatic. I like the idea of having a wandering boss actively hunting down your afflicted heroes but, especially at the beginning, this boss can be very hard to defeat and it can be frustrating to lose a party member due to a boss that can feel overpowered. However, like any other boss in DD, it's easy once you know how.

The new dungeon i.e. The Courtyard is both good and bad. It's a huge place and it is not meant to be explored in one go. The positive side is that you can leave at any time and you can restart from where you left but, as a negative, there are quite a few hard encounters which can wreck your day if you just charge in.

I did find it tedious at times to simply go in to explore and map out the whole level also considering that, in order to enter, you will need “invitations” which will only drop from the new enemies that you will encounter in the original dungeons and this is what annoyed me the most as, every time you enter the courtyard, you will use one invitation, even if you do not kill the boss. But, so far, I've managed to find quite a few of those but I do not like the idea of limiting access to a dungeon, considering also its size.

The new class, the flagellant, is good and can feel more powerful than the other classes when dealing with enemies that bleed and you will have access to him fairly soon. Some of his abilities seem to be too good but, considering the new difficulty spikes, it's a fair trade off.

So, is it bad? Is it good? As per DD, it is not for everyone and some of the mechanics can be annoying but overall it is a good DLC that will hopefully, sate your thirst for blood.",76561198003430076,0,17,0,0,,1970-01-01T00:00:00+00:00
steam,580100,Crimson Court,True,unknown,96911274,english,2021-08-04T05:18:09+00:00,2021-08-04T05:18:09+00:00,True,24,0,0,0.732698440551757812,,False,False,,"Don't be put off by the ""Mixed"" reviews, this DLC is a fantastic boon to the mid-to-late game of the campaign that keeps the game from feeling stagnant. Having an sort of alternate main quest that you have to choose when to progress in is really fresh, and the new enemies and bosses are all fantastic, with the exception of the very last (but also very optional) boss. Definitely heed the game's warning about enabling it if you're apprehensive about difficulty, but once you've learned the game's systems, all the content this expansion adds is exceptional.",76561198184171743,0,15,0,0,,1970-01-01T00:00:00+00:00
steam,580100,Crimson Court,True,unknown,35650455,english,2017-10-12T01:58:28+00:00,2017-10-12T02:08:45+00:00,False,57,2,0,0.732201814651489258,,False,False,,"The only thing i like about this DLC is the new art. All of the rest doesn't really go well with the base game. The crimson curse system just doesn't add any enjoyable depth to the game. It's just tedious micro management. And there already was quite some of that in the game.
The new dungeons are not random anymore. Wich could be ok i guess, if there were a lotofthem . But there are not and you just get the feeling that there is nothing to explore and somehow it makes the game feel stale.
To actually play the second dungeon of the crimson course, you have to farm items that randomly spawn from random encounters in the old dungeons... yeah, it plays as annoying as it sounds.

I am really wondering how they were able to come up with such a disappointing DLC, after they had such a great start with the game.

really doesn't recommend it. It makes the vanilla experience somewhat less enjoyable. If anything buy it after you finished the base game.

It's weird. Usually i enjoy expansions when i like the game, but with this one it is not the case.",76561198048470733,0,11,0,0,,1970-01-01T00:00:00+00:00
steam,580100,Crimson Court,True,unknown,47338614,english,2018-12-07T02:07:25+00:00,2019-05-15T13:45:49+00:00,True,51,5,1,0.731454014778137207,,False,False,,"I recommend this for the extras, not the campaign. If it were just the campaign, I'd thumb this down so hard, lol.
Flagellant is an ugly version of my boyfriend (at the time of writing), and just so happens to be an extremely fun and versatile class... 10/10
Districts are something to do with all the extra stuff you have, and the effects make things a little ""nicer"" in such an otherwise cruel and unforgiving game.

Important Edit: You can turn the Crimson Court Campaign, Flagellant Class, and Districts on or off individually at any time. Again reinforcing why this can still get a thumbs up despite the core content.

The campaign itself... well, eh... I'm glad it's not as bad as it was on release, but wow. The campaign constantly screams at you to pay attention to it, or else. If you start a game with the campaign enabled, you'll be swarmed every week with a stress recovery debuff, meaning you're going to have a roster full of increasingly stressed out idiots that you're just not going to be able to quell. It'd be fine if the swarm event started spamming itself when you should be able to start the content, but it happens while your roster is full of 0s and a few 1s.
Believe me, you can't just walk in there with your 0s and 1s, they'll be eaten alive by the lovely Crocodilian you'll see some people crying about (and yes, it really is as unenjoyable to fight as most people make it out to be), so you're going to be seeing ""The Town is Abuzz"" over and over... and over... and over... for a fair while as you build up a team ready to shut the damn thing up.

But oh, once you go shut the event up, and finally you have some (relative) peace in the Hamlet, now your entire game is infected. Have fun!

One of the very many charms of Darkest Dungeon is how heroes who go crazy, tend to at least have lines suited to their class or role. But the curse...? No, the curse's script is just lazy (no way to sugarcoat this, it is lazy).
The same small set of lines for each and every character... yes, shut the hell up, I've read that line 50 times already - in the current playsession. The Crimson Curse basically possesses your characters with the personality of the exact same teenage vampire edgelord. I can't imagine how frustrating it used to be on release, what with the 1/3 chance of infection creating an army for this one edgy dumbass to speak through, because I was bored of the curse within a couple of hours at most.

Aside from that, it's a welcome change to have some huge dungeons you can come and go from as you please (people complaining about no camping aren't making any sense - being able to go back home renders camping pointless, and even then there's still a way to camp if you experiment with the new curios), and the bosses are interesting.
The Countess is a nightmare and puts the Darkest Dungeon itself to shame, but still beatable.

The enemies are okay and varying degrees of just the right amount of annoying... only complaint is with the Chevalier.
Chevalier should really be a Size 2 with a little more health (his sprites are clearly Size 2, but for some reason they have him clipping horribly with surrounding enemies in a single slot). Oh yeah... those big Chevalier bugs are going to be the main cause for deaths to this content. Have fun!

New trinkets are a mixed bag, and appear to be infamously bad overall according to the community.
The first trinkets I got were the Vial of Sand and Glass Shard, so of course I thought they looked decent at first, but that was just me being lucky and getting two of the only good ones of the lot... then I saw the rest eventually (what the hell is with the Bounty Hunter's and Jester's sets?!).
Oh yeah, and speaking of trinkets? The Boss Trophies are worthless (not hyperbole; they are worthless). Maybe the first will be useful for a little more speed on someone for a few expeditions, but that's it.

If you really love Darkest Dungeon, it's worth trying this mistake of a campaign out on your second playthrough (the game actually warns you it'll ruin your experience if you switch the campaign on in your first run). Then it's up to you if you ever do it again.
People who love the way it infects the game, and gamer masochists, will love it forever and never turn it off (not even temporarily at the start of an estate).",76561198073592598,275,37,0,0,,1970-01-01T00:00:00+00:00
steam,580100,Crimson Court,True,unknown,171436378,english,2024-08-04T17:30:15+00:00,2024-08-04T17:30:15+00:00,True,15,0,0,0.680017173290252686,,False,False,,"I was worried because negative reviews. They must've gotten a different DLC than me. This DLC adds new enemies content trinkets music and the aesthetic is boss af. You can contract a disease which is this whole new dope mechanic and can actually be beneficial. The bosses and quests are cool. It is NOT harder than the main game despite what people say the only hard part IMO is the fanatic that roams. Here's the cool thing when you load in it warns you he might be there, just quit quest if he is that scary otherwise have rear hitting parties. This game by itself is challenging so I'm really confused about the reviews. A good addition.",76561198308148665,1870,282,0,0,,1970-01-01T00:00:00+00:00
steam,580100,Crimson Court,True,unknown,139138693,english,2023-05-28T07:23:21+00:00,2023-05-28T07:23:21+00:00,True,22,0,0,0.728339135646820068,,False,False,,You know I wanted to give this dlc a bad review because I thought it was poorly designed but after reading some of the reviews and looking back on my skill level I realized it's me who just not that good at the game. If you a new player to this series do yourself a favor and disable this dlc. You are definitely not ready for it as was I. I really enjoyed the original game. I never understood games like dark souls until I played this game. It kicks your ass hard. But it's that that makes me want to play more. And as a new player this dlc almost broke that love I had. Yes I said most of the problems are from me not being good enough but this is needed for new players to know or else they may refund the game or ignore it forever which is not something I want. First (I might have just been really unlucky but I mentioning it) every week you will get a event that basically just weakens all stress relief buildings not by much but it can get annoy because some of the more useful and horrible events are basically locked out of the game. Second you fix it by doing the first courtyard mission which was a really fun challenge especially the boss fight. However this causes and even greater issue. The creatures from the courtyard now show up as encounters in the rest of the game. Which cause one of if not the biggest issue in the dlc specially for newer players. The crimson curse. This was the worst thing to experience. The creatures are decently common I'd say you run into them once every 3-5 battles. They have insanely high resistances and life steal. But that wouldn't have been so bad. Because the curse is the worst thing to deal with. Almost every one of their attacks can give the curse. Which makes your heroes weaker to the point they die. The only way to fix this is finding blood. How do you get blood you ask. RNG or winning the fights with the creatures. This isn't a temporary solution though and some cursed heroes need one or two blood to keep them alive on the shortest mission. In order to get a more permanent fix you either need to take out the new boss which only comes on a specific event and only fights you when you have 2 or more cursed heroes. Not that much right. In the stagecoach yes but it needs to be on your main team. Yes half your team needs to be infected and only they get cured (not sure about that one though never won against him). Or you can try the more reliable solution and beat the veteran lv quest it has. Oh it's an epic length quest so it probably going give me 3-4 firewood to camp and... NOPE IT'S A ONE HUNDRED ROOM DUNGEON IN WHICH YOU NEED TO GET THROUGH 3 GATES WITH SPECIFIC KEYS WITH THERE OWN 3 BOSS WHILE FIGHTING ONLY ENEMIES THAT GIVE THE CURSE. AND ONE FINAL BOSS FIGHT AT THE END AND THEN EVERYONE IS CURED. When I start this quest I had maybe 2-3 of my heroes infected. By the time I got to the first gate I had 9. This game really need a warning to those who bought the dlc saying it's a difficulty tweak because holy I grew to hate this game as I play more with this dlc. However after reading more of the reviews from this I want to give it a recommendation because everyone has convinced me that I need to get better and not blame the game. Doesn't excuse the lack of a warning though but hey I have another chance at getting that one achievement for beating the game with the first two guys.,76561199096076735,511,171,0,0,,1970-01-01T00:00:00+00:00
steam,580100,Crimson Court,True,unknown,86563487,english,2021-02-13T18:14:03+00:00,2021-02-13T18:14:03+00:00,True,47,5,0,0.775665044784545898,,False,False,,"Enable Districts+Enable Flagellant, DON'T Enable Crimson Court=Profit",76561198079741045,430,14,0,0,,1970-01-01T00:00:00+00:00
steam,580100,Crimson Court,True,unknown,32609858,english,2017-06-21T04:52:10+00:00,2017-06-21T04:52:10+00:00,False,110,4,9,0.72081524133682251,,False,False,,"Abosultely terrible DLC for a near-perfect game. It pains me to give anything less than a good review for this DLC. I've done everything and have always been beside Redhook but this DLC really dropped the bal. It's like they took all the bad parts of DD and mistook it as the good parts. 

They ignored cries of the game beign too grindy and made the new dungeon require TONS of gridnign to even access. They ignored cries of the game having too much RNG and made a new disease that you can't prevent that will randomly kill people, is mostly unstoppable, and can just ruin runs that were going well where you did everythign correctly.

If you buy this for the Crimson Court you WILL be dissapointed. You will be forced to replay old portions of the game for AT MINIMUM 2 hours until you can access more than a quarter of the new content in the new dungeon. It's a tradgedy that they make you pay for somethign new when it's mostly focesed on old content.

If you get this I 100% suggest trying to mod out the invitation system completely. Hopefully someone creates that mod alleviates this terrible stain on such a good game.

However... even then you're stil left with the actual state of the Crimson Court itself. It's empty. The same rooms are recyled in all 4 runs. It's massive and has mostly hallways. And it will require multiple tries since you're very likely to have RNG make the new disease randomly take one of your heros away by just instantly killing them.

The new disease is unstoppable. It has trhe downsides of something as if it were balanced to be controllable but it isn't.In DD, you are punihsed for allowing bad things like Deaths Door to happen. However, this new disease is unpreventable and uncurable. This means that you have to deal with the downsides of something without even getting the chance to interact with it.

I was so happy for a new disease because I though I'd get toprevent it or slow it's spread somehow - or perhaps slow the symptoms. However all of it is RNG dependant.

[b]It astonishes me how thye centered this DLC on something that is the epitome of the 2 things that this game gets bad review/complaints for: RNG and HUGE grind.[/b]

If I wanted to play the old portion of the game for several days again I wouldn't have bought the DLC. Why do you think I bought it if I was just going to spend most of my time just trying to get a R~a~N~d~O~m invitation to drop just so I can even get a glimpse of more than one quarter of the new content?

This needs to be fixed ASAP. As of now it is just a slap in the face to lovers of DD and it's devs.",76561198041844310,444,172,0,0,,1970-01-01T00:00:00+00:00
steam,580100,Crimson Court,True,unknown,42028381,english,2018-05-14T02:13:27+00:00,2018-05-14T02:13:27+00:00,False,29,1,0,0.668447256088256836,,False,False,,"In short my opinion of base Darkest Dungeon is that it's almost 10/10 but some aspects needing work.

So to dive right in we already know that Crimson Court is beautiful, perfectly narrated and so on.
The reason I don't recommend Crimson Court is that it burdens some of the worst aspects of the base game. *spoilers ahead*
First of all the crimson curse is just far too abundant. Second hit gave me the curse. It's just a constant nuisance, it's almost as though CC is a DLC debuff to your characters.
Now you have to manage your inventory to constantly bring/pick up blood making your inventory problems worse.
It's just another food - you may need 0 or 24. Who knows (I'm being a little extreme).
You will now have one less slot to pick up valuables/heirlooms.

Now I do LOVE the flagellant (op) and the districts are nice - but I would love some more 'low level' districts to balance out the overwhelming disgust of the Crimson Curse.
I enjoy the Crimson Court itself but the tedium of needing more blood than what I could ever hope to gather makes it less than favorable - I really wish it had some extra value (like just higher gold/trinket/heirloom rewards to balance out the curse to keep it simple).

I am not saying that it's too hard as I am enjoying a lot of the new fights. I feel like this DLC weighs too heavily on some of the worst aspects of the game without adding enough elsewhere.
I honestly feel like it could be just a few small updates away from being a perfect addition.",76561198090934295,0,13,0,0,,1970-01-01T00:00:00+00:00
steam,580100,Crimson Court,True,unknown,32843898,english,2017-06-27T06:20:24+00:00,2017-06-27T06:20:24+00:00,False,71,1,0,0.716342687606811523,,False,False,,"Wish I had read the reviews before jumping on this one... Man this DLC is a real pain. As everyone else has already said, the curse is extremely hard to deal with and very common. Even using the mod that reduces the chance to get the curse I'm still finding I get it way too often. According to the wiki the only way you can get rid of the curse is to get an invitation to and complete a quest in the new Courtyard area (not including the starting quest), which would be fine if it wasn't impossible to get an invitation. Now my best characters have it and I can't be bothered to play anymore.

The curse is irritating and so is the fact that entry to the new area is difficult to gain.

I feel like the only way you might like this DLC is if you're desperate for something Darkest Dungeon and have already beaten the game, looking to start a fresh save with some new things, even if they are irritating... I was personally hoping for something to supplement the current game to make me want to play more because I'm not a fan of constant grind, but I love the atmosphere of DD and want to love it.",76561198052341991,408,55,0,0,,1970-01-01T00:00:00+00:00
steam,580100,Crimson Court,True,unknown,94983275,english,2021-07-03T20:06:17+00:00,2021-07-03T20:06:17+00:00,False,20,0,0,0.663253545761108398,,False,False,,"The flagellant is good and fun to use, the new trinkets are good for the most part, the new buildings are most welcomed and the new enemies are alright. The problem lies with the crimson curse that will inevitably infect more and more of your roster if you delay the trips to the static dungeons. That's right they are big static dungeons and on top of that it requires an invitation for each entry because it is not meant to be beaten in one expedition but multiples. To get an invitation back you need to go in the base game dungeons that are now infested with some of the new enemies that can give the crimson curse as well. Even after finishing the dlc and getting a way to remove it in the hamlet it remains an annoyance permanently to be dealt with. I'm not even sure I can recommend this as post-game content, it made my experience less enjoyable. It's possible to not start it and get the new buildings and class and that's probably the only way I can recommend this dlc unironically by enabling it but not starting it, you won't get the new trinkets but I don't think they are worth the hassle honestly.",76561198020789907,0,156,0,0,,1970-01-01T00:00:00+00:00
